# pivot using an enum
statement ok
CREATE TABLE monthly_sales(empid INT, amount INT, month TEXT);

statement ok
INSERT INTO monthly_sales VALUES
    (1, 10000, '1-JAN'),
    (1, 400, '1-JAN'),
    (2, 4500, '1-JAN'),
    (2, 35000, '1-JAN'),
    (1, 5000, '2-FEB'),
    (1, 3000, '2-FEB'),
    (2, 200, '2-FEB'),
    (2, 90500, '2-FEB'),
    (1, 6000, '3-MAR'),
    (1, 5000, '3-MAR'),
    (2, 2500, '3-MAR'),
    (2, 9500, '3-MAR'),
    (1, 8000, '4-APR'),
    (1, 10000, '4-APR'),
    (2, 800, '4-APR'),
    (2, 4500, '4-APR');

# top level PIVOT syntax
#PIVOT monthly_sales ON MONTH USING SUM(AMOUNT)
query IIIII rowsort
monthly_sales PIVOT (SUM(AMOUNT) FOR MONTH IN (select distinct month from monthly_sales) GROUP BY empid);
----
1	10400	8000	11000	18000
2	39500	90700	12000	5300

# PIVOT monthly_sales ON MONTH IN ('1-JAN', '2-FEB', '3-MAR', '4-APR') USING SUM(AMOUNT) GROUP BY empid
query IIIII rowsort

monthly_sales PIVOT (SUM(AMOUNT) FOR MONTH IN ('1-JAN', '2-FEB', '3-MAR', '4-APR') GROUP BY empid);
----
1	10400	8000	11000	18000
2	39500	90700	12000	5300

# PIVOT monthly_sales ON MONTH IN ('1-JAN', '2-FEB', '3-MAR') USING SUM(AMOUNT) GROUP BY empid
query IIII rowsort
monthly_sales PIVOT (SUM(AMOUNT) FOR MONTH IN ('1-JAN', '2-FEB', '3-MAR') GROUP BY empid);
----
1	10400	8000	11000
2	39500	90700	12000

# add a column
statement ok
ALTER TABLE monthly_sales ADD COLUMN status VARCHAR

statement ok
UPDATE monthly_sales SET status=CASE WHEN amount >= 10000 THEN 'important' ELSE 'regular' END

# GROUP BY syntax in the SQL standard PIVOT clause
#SELECT *
#  FROM monthly_sales
#    PIVOT(SUM(amount) FOR MONTH IN ('1-JAN', '2-FEB', '3-MAR', '4-APR') GROUP BY status)
#      AS p
#  ORDER BY 1;
query IIIII
monthly_sales
PIVOT (
  SUM(AMOUNT)
  FOR MONTH IN ('1-JAN', '2-FEB', '3-MAR', '4-APR')
  GROUP BY status
) ORDER BY status;
----
important	45000	90500	NULL	10000
regular	4900	8200	23000	13300

# in CTE
query IIIII
WITH pivoted_sales AS (monthly_sales PIVOT (SUM(AMOUNT) FOR MONTH IN (select distinct month from monthly_sales) GROUP BY empid))
SELECT * FROM pivoted_sales ORDER BY empid DESC;
----
2	39500	90700	12000	5300
1	10400	8000	11000	18000